{
  "took": 6,
  "timed_out": false,
  "_shards": {
    "total": 1,
    "successful": 1,
    "skipped": 0,
    "failed": 0
  },
  "hits": {
    "total": {
      "value": 15,
      "relation": "eq"
    },
    "max_score": 4.0893116,
    "hits": [
      {
        "_index": "soa",
        "_id": "AMFMeanRegNbr@NF:AMF_ON1::SNSSAI:2:1::",
        "_score": 4.0893116,
        "_source": {
          "full_context": "NF_SNSSAI",
          "context": ["SNSSAI", "NF"],
          "c_SNSSAI": "2:1",
          "c_NF": "AMF_ON1",
          "vi_NF_SNSSAI_AMFMeanRegNbr": 40
        }
      },
      {
        "_index": "soa",
        "_id": "AMFMeanRegNbr3@NF:AMF_ON1::SNSSAI:2:1::",
        "_score": 4.0893116,
        "_source": {
          "full_context": "NF_SNSSAI",
          "context": ["SNSSAI", "NF"],
          "c_SNSSAI": "2:1",
          "c_NF": "AMF_ON1",
          "vi_NF_SNSSAI_AMFMeanRegNbr3": 40
        }
      },
      {
        "_index": "soa",
        "_id": "AMFMeanRegNbr@NF:AMF_BC::SNSSAI:1:1::",
        "_score": 3.9819288,
        "_source": {
          "full_context": "NF_SNSSAI",
          "context": ["SNSSAI", "NF"],
          "c_SNSSAI": "1:1",
          "c_NF": "AMF_BC",
          "vi_NF_SNSSAI_AMFMeanRegNbr": 10
        }
      },
      {
        "_index": "soa",
        "_id": "AMFMeanRegNbr@NF:AMF_BC::SNSSAI:1:2::",
        "_score": 3.9819288,
        "_source": {
          "full_context": "NF_SNSSAI",
          "context": ["SNSSAI", "NF"],
          "c_SNSSAI": "1:2",
          "c_NF": "AMF_BC",
          "vi_NF_SNSSAI_AMFMeanRegNbr": 20
        }
      },
      {
        "_index": "soa",
        "_id": "AMFMeanRegNbr2@NF:AMF_BC::SNSSAI:1:1::",
        "_score": 3.9819288,
        "_source": {
          "full_context": "NF_SNSSAI",
          "context": ["SNSSAI", "NF"],
          "c_SNSSAI": "1:1",
          "c_NF": "AMF_BC",
          "vi_NF_SNSSAI_AMFMeanRegNbr2": 10
        }
      },
      {
        "_index": "soa",
        "_id": "AMFMeanRegNbr2@NF:AMF_BC::SNSSAI:1:2::",
        "_score": 3.9819288,
        "_source": {
          "full_context": "NF_SNSSAI",
          "context": ["SNSSAI", "NF"],
          "c_SNSSAI": "1:2",
          "c_NF": "AMF_BC",
          "vi_NF_SNSSAI_AMFMeanRegNbr2": 20
        }
      },
      {
        "_index": "soa",
        "_id": "AMFMeanRegNbr3@NF:AMF_BC::SNSSAI:1:1::",
        "_score": 3.9819288,
        "_source": {
          "full_context": "NF_SNSSAI",
          "context": ["SNSSAI", "NF"],
          "c_SNSSAI": "1:1",
          "c_NF": "AMF_BC",
          "vi_NF_SNSSAI_AMFMeanRegNbr3": 10
        }
      },
      {
        "_index": "soa",
        "_id": "AMFMeanRegNbr3@NF:AMF_BC::SNSSAI:1:2::",
        "_score": 3.9819288,
        "_source": {
          "full_context": "NF_SNSSAI",
          "context": ["SNSSAI", "NF"],
          "c_SNSSAI": "1:2",
          "c_NF": "AMF_BC",
          "vi_NF_SNSSAI_AMFMeanRegNbr3": 20
        }
      },
      {
        "_index": "soa",
        "_id": "AMFMeanRegNbr@NF:AMF_ON2::SNSSAI:2:1::",
        "_score": 3.9462109,
        "_source": {
          "full_context": "NF_SNSSAI",
          "context": ["SNSSAI", "NF"],
          "c_SNSSAI": "2:1",
          "c_NF": "AMF_ON2",
          "vi_NF_SNSSAI_AMFMeanRegNbr": 60
        }
      },
      {
        "_index": "soa",
        "_id": "AMFMeanRegNbr2@NF:AMF_ON2::SNSSAI:2:1::",
        "_score": 3.9462109,
        "_source": {
          "full_context": "NF_SNSSAI",
          "context": ["SNSSAI", "NF"],
          "c_SNSSAI": "2:1",
          "c_NF": "AMF_ON2",
          "vi_NF_SNSSAI_AMFMeanRegNbr2": 60
        }
      }
    ]
  }
}
